<?xml version="1.0" encoding="UTF-8"?>
<list xmlns:xsi="http://www.w3.org/2001/XMLSchema-instance"  xmlns="http://l2j.org" xsi:schemaLocation="http://l2j.org ../../xsd/skillTrees.xsd">
	<skillTree type="classSkillTree" classId="4" parentClassId="0">
		<skill name="Ultimate Defense" id="110" level="1" required-level="20" sp="1000" />
		<skill name="Majesty" id="82" level="1" required-level="20" sp="1000" />
		<skill name="Sword/Blunt Weapon Mastery" id="217" level="1" required-level="20" sp="1000" />
		<skill name="Heavy Armor Mastery" id="232" level="1" required-level="20" sp="1000" />
		<skill name="Heavy Armor Mastery" id="232" level="2" required-level="20" sp="1000" />
		<skill name="Heavy Armor Mastery" id="232" level="3" required-level="20" sp="1000" />
		<skill name="Shield Mastery" id="153" level="1" required-level="20" sp="1000" />
		<skill name="Magic Resistance" id="147" level="1" required-level="20" sp="1000" />
		<skill name="Magic Resistance" id="147" level="2" required-level="20" sp="1000" />
		<skill name="Shield Stun" id="92" level="1" required-level="20" sp="1000" />
		<skill name="Shield Stun" id="92" level="2" required-level="20" sp="1000" />
		<skill name="Shield Stun" id="92" level="3" required-level="20" sp="1000" />
		<skill name="Drain Energy" id="70" level="1" required-level="20" sp="1000">
			<item id="1097"/>
		</skill>

		<skill name="Aggression" id="28" level="1" required-level="22" sp="2800" />
		<skill name="Heavy Armor Mastery" id="232" level="4" required-level="22" sp="2800" />
		<skill name="Drain Energy" id="70" level="2" required-level="22" sp="2800" />
		<skill name="Magic Resistance" id="147" level="3" required-level="22" sp="2800" />
		<skill name="Shield Stun" id="92" level="4" required-level="22" sp="2800" />

		<skill name="Aggression" id="28" level="2" required-level="23" sp="2800" />
		<skill name="Heavy Armor Mastery" id="232" level="5" required-level="23" sp="2800" />
		<skill name="Drain Energy" id="70" level="3" required-level="23" sp="2800" />
		<skill name="Magic Resistance" id="147" level="4" required-level="23" sp="2800" />
		<skill name="Shield Stun" id="92" level="5" required-level="23" sp="2800" />
		
		<skill name="Aggression" id="28" level="3" required-level="24" sp="2800" />
		<skill name="Sword/Blunt Weapon Mastery" id="217" level="2" required-level="24" sp="2800" />
		<skill name="Heavy Armor Mastery" id="232" level="6" required-level="24" sp="2800" />
		<skill name="Drain Energy" id="70" level="4" required-level="24" sp="2800" />
		<skill name="Magic Resistance" id="147" level="5" required-level="24" sp="2800" />
		<skill name="Shield Stun" id="92" level="6" required-level="24" sp="2800" />
		<skill name="Deflect Arrow" id="112" level="1" required-level="24" sp="2800" />
		
		<skill name="Aggression" id="28" level="4" required-level="26" sp="5700" />
		<skill name="Sword/Blunt Weapon Mastery" id="217" level="3" required-level="26" sp="5700" />
		<skill name="Heavy Armor Mastery" id="232" level="7" required-level="26" sp="5700" />
		<skill name="Drain Energy" id="70" level="5" required-level="26" sp="5700" />
		<skill name="Magic Resistance" id="147" level="6" required-level="26" sp="5700" />
		<skill name="Shield Stun" id="92" level="7" required-level="26" sp="5700" />
		<skill name="Divine Heal" id="45" level="1" required-level="26" sp="5700">
			<item id="1378"/>
		</skill>
		
		<skill name="Aggression" id="28" level="5" required-level="27" sp="5700" />
		<skill name="Heavy Armor Mastery" id="232" level="8" required-level="27" sp="5700" />
		<skill name="Drain Energy" id="70" level="6" required-level="27" sp="5700" />
		<skill name="Magic Resistance" id="147" level="7" required-level="27" sp="5700" />
		<skill name="Shield Stun" id="92" level="8" required-level="27" sp="5700" />
		<skill name="Divine Heal" id="45" level="2" required-level="27" sp="5700" />
		
		<skill name="Aggression" id="28" level="6" required-level="28" sp="5700" />
		<skill name="Sword/Blunt Weapon Mastery" id="217" level="4" required-level="28" sp="5700" />
		<skill name="Heavy Armor Mastery" id="232" level="9" required-level="28" sp="5700" />
		<skill name="Shield Mastery" id="153" level="2" required-level="28" sp="5700" />
		<skill name="Drain Energy" id="70" level="7" required-level="28" sp="5700" />
		<skill name="Magic Resistance" id="147" level="8" required-level="28" sp="5700" />
		<skill name="Shield Stun" id="92" level="9" required-level="28" sp="5700" />
		<skill name="Divine Heal" id="45" level="3" required-level="28" sp="5700" />
		
		<skill name="Aggression" id="28" level="7" required-level="30" sp="11000" />
		<skill name="Sword/Blunt Weapon Mastery" id="217" level="5" required-level="30" sp="11000" />
		<skill name="Heavy Armor Mastery" id="232" level="10" required-level="30" sp="11000" />
		<skill name="Drain Energy" id="70" level="8" required-level="30" sp="11000" />
		<skill name="Magic Resistance" id="147" level="9" required-level="30" sp="11000" />
		<skill name="Shield Stun" id="92" level="10" required-level="30" sp="11000" />
		<skill name="Divine Heal" id="45" level="4" required-level="30" sp="11000" />
		
		<skill name="Aggression" id="28" level="8" required-level="31" sp="11000" />
		<skill name="Heavy Armor Mastery" id="232" level="11" required-level="31" sp="11000" />
		<skill name="Drain Energy" id="70" level="9" required-level="31" sp="11000" />
		<skill name="Magic Resistance" id="147" level="10" required-level="31" sp="11000" />
		<skill name="Shield Stun" id="92" level="11" required-level="31" sp="11000" />
		<skill name="Divine Heal" id="45" level="5" required-level="31" sp="11000" />
		
		<skill name="Aggression" id="28" level="9" required-level="32" sp="11000" />
		<skill name="Sword/Blunt Weapon Mastery" id="217" level="6" required-level="32" sp="11000" />
		<skill name="Heavy Armor Mastery" id="232" level="12" required-level="32" sp="11000" />
		<skill name="Drain Energy" id="70" level="10" required-level="32" sp="11000" />
		<skill name="Magic Resistance" id="147" level="11" required-level="32" sp="11000" />
		<skill name="Shield Stun" id="92" level="12" required-level="32" sp="11000" />
		<skill name="Deflect Arrow" id="112" level="2" required-level="32" sp="11000" />
		<skill name="Divine Heal" id="45" level="6" required-level="32" sp="11000" />

		<skill name="Aggression" id="28" level="10" required-level="34" sp="20000" />
		<skill name="Sword/Blunt Weapon Mastery" id="217" level="7" required-level="34" sp="20000" />
		<skill name="Heavy Armor Mastery" id="232" level="13" required-level="34" sp="20000" />
		<skill name="Drain Energy" id="70" level="11" required-level="34" sp="20000" />
		<skill name="Magic Resistance" id="147" level="12" required-level="34" sp="20000" />
		<skill name="Shield Stun" id="92" level="13" required-level="34" sp="20000" />
		<skill name="Divine Heal" id="45" level="7" required-level="34" sp="20000" />
		
		<skill name="Aggression" id="28" level="11" required-level="35" sp="20000" />
		<skill name="Heavy Armor Mastery" id="232" level="14" required-level="35" sp="20000" />
		<skill name="Drain Energy" id="70" level="12" required-level="35" sp="20000" />
		<skill name="Magic Resistance" id="147" level="13" required-level="35" sp="20000" />
		<skill name="Shield Stun" id="92" level="14" required-level="35" sp="20000" />
		<skill name="Divine Heal" id="45" level="8" required-level="35" sp="20000" />
		
		<skill name="Aggression" id="28" level="12" required-level="36" sp="20000" />
		<skill name="Sword/Blunt Weapon Mastery" id="217" level="8" required-level="36" sp="20000" />
		<skill name="Heavy Armor Mastery" id="232" level="15" required-level="36" sp="20000" />
		<skill name="Drain Energy" id="70" level="13" required-level="36" sp="20000" />
		<skill name="Magic Resistance" id="147" level="14" required-level="36" sp="20000" />
		<skill name="Shield Stun" id="92" level="15" required-level="36" sp="20000" />
		<skill name="Divine Heal" id="45" level="9" required-level="36" sp="20000" />
		<skill name="Focus Mind" id="191" level="1" required-level="36" sp="20000" />
	</skillTree>
</list>