<?xml version="1.0" encoding="UTF-8"?>
<list xmlns:xsi="http://www.w3.org/2001/XMLSchema-instance"  xmlns="http://l2j.org" xsi:schemaLocation="http://l2j.org ../../xsd/skillTrees.xsd">
	<skillTree type="classSkillTree" classId="209" parentClassId="208">

		<!-- Master Buffs Lv. 20 -->
		<skill name="Elemental Empower" id="47029" level="1" required-level="20" sp="1000" />
		<skill name="Elemental Wind Walk" id="47024" level="1" required-level="20" sp="1000" />
		<skill name="Elemental Might" id="47026" level="2" required-level="20" sp="1000" />
		<skill name="Elemental Acumen" id="47028" level="1" required-level="20" sp="1000" />
		<skill name="Elemental Haste" id="47023" level="1" required-level="20" sp="1000" />
		<skill name="Elemental Focus" id="47021" level="1" required-level="20" sp="1000" />
		<skill name="Elemental Clarity" id="47032" level="1" required-level="20" sp="1000" />
		<skill name="Elemental Death Whisper" id="47022" level="1" required-level="20" sp="1000" />
		<skill name="Elemental Shield" id="47027" level="2" required-level="20" sp="1000" />

		<!-- Skills Lv20 -->
		<skill name="Light Armor Mastery" id="47082" level="1" required-level="20" sp="1000" />
		<skill name="Firearms Mastery" id="47081" level="1" required-level="20" sp="1000" />
		<skill name="Recover HP" id="45176" level="1" required-level="20" sp="1000" />
		<skill name="Recover MP" id="45177" level="1" required-level="20" sp="1000" />
		<skill name="Ability to Protect" id="91" level="2" required-level="20" sp="1000" />
		<skill name="Soul Strike" id="1516" level="1" required-level="20" sp="1000" />
		<skill name="Dual Blow" id="47002" level="1" required-level="20" sp="1000" />
		<skill name="Elemental Connection" id="47104" level="2" required-level="40" sp="1000" />

		<!-- Skills Lv21 -->
		<skill name="Dual Blow" id="47002" level="2" required-level="21" sp="2500" />

		<!-- Skills Lv25 -->
		<skill name="Ability to Attack" id="77" level="2" required-level="25" sp="5500" />

		<!-- Skills Lv27 -->
		<skill name="Critical Chance" id="137" level="1" required-level="27" sp="5500" />

		<!-- Skills Lv28 -->
		<skill name="Dual Blow" id="47002" level="3" required-level="28" sp="5500" />


		<!-- Skills Lv30 -->
		<skill name="Elemental Focus" id="47021" level="1" required-level="2" sp="10000" />
		<skill name="Elemental Death Whisper" id="47022" level="2" required-level="20" sp="10000" />
		<skill name="Elemental Wind Walk" id="47024" level="2" required-level="20" sp="1000" />
		<skill name="Elemental Magic Barrier" id="47025" level="1" required-level="20" sp="10000" />
		<skill name="Elemental Acumen" id="47028" level="2" required-level="20" sp="10000" />
		<skill name="Elemental Empower" id="47029" level="2" required-level="20" sp="10000" />
		<skill name="Elemental Wild Magic" id="47030" level="1" required-level="20" sp="10000" />
		<skill name="Elemental Berserker Spirit" id="47031" level="1" required-level="30" sp="10000" />
		<skill name="Elemental Clarity" id="47032" level="2" required-level="30" sp="10000" />

		<!-- Skills Lv32 -->
		<skill name="Dual Blow" id="47002" level="4" required-level="32" sp="18000" />

		<!-- Skills Lv35 -->
		<skill name="Long Range Attack" id="47084" level="1" required-level="35" sp="20000" />

		<!-- Skills Lv36 -->
		<skill name="Dual Blow" id="47002" level="5" required-level="36" sp="20000" />
		
	</skillTree>
</list>