<?xml version="1.0" encoding="UTF-8"?>
<list xmlns:xsi="http://www.w3.org/2001/XMLSchema-instance"  xmlns="http://l2j.org" xsi:schemaLocation="http://l2j.org ../../xsd/skillTrees.xsd">
	<skillTree type="classSkillTree" classId="100" parentClassId="21">
		<skill name="White Guardian" id="54102" level="1" required-level="80" >
			<item id="92401"/>
		</skill>
		<skill name="Arrest" id="402" level="11" required-level="76" sp="10200000" />
		<skill name="Sword/Blunt Weapon Mastery" id="217" level="46" required-level="76" sp="10200000" />
		<skill name="Heavy Armor Mastery" id="232" level="53" required-level="76" sp="10200000" />
		<skill name="Magic Resistance" id="147" level="52" required-level="76" sp="10200000" />
		<skill name="Entangle" id="102" level="17" required-level="76" sp="10200000" />
		<skill name="Charm" id="15" level="53" required-level="76" sp="10200000" />
		<skill name="Sword Symphony" id="98" level="6" required-level="76" sp="10200000" />
		<skill name="Deadly Strike" id="1632" level="1" required-level="76" sp="10200000" />
		<skill name="Divine Inspiration" id="1405" level="3" required-level="76" sp="10200000">
			<item id="8620"/> <!-- Ancient Book: Divine Inspiration (Manuscript) -->
		</skill>
		<skill name="Divine Inspiration" id="1405" level="4" required-level="76" sp="10200000">
			<item id="8621"/> <!-- Ancient Book: Divine Inspiration (Original Version) -->
		</skill>
		<skill name="Mount Pegasus" id="1834" level="1" required-level="76">
			<item id="90039"/> <!-- Spellbook: Mount Pegasus -->
		</skill>
		<skill name="Glory Ability" id="45361" level="1" required-level="86">
			<item id="94046"/> <!-- Spellbook: Glory Ability Lv. 1 -->
		</skill>
		<skill name="Mount White Wings" id="54200" level="1" required-level="87">
			<item id="93059"/> <!-- Spellbook: Summon White Wings -->
		</skill>	
		<skill name="Mount Shining Lady" id="54202" level="1" required-level="89">
			<item id="93061"/> <!-- Spellbook: Summon Silver Saint -->
		</skill>
		
		<skill name="Sword/Blunt Weapon Mastery" id="217" level="47" required-level="77" sp="10200000" />
		<skill name="Heavy Armor Mastery" id="232" level="54" required-level="77" sp="10200000" />
		<skill name="Magic Resistance" id="147" level="53" required-level="77" sp="10200000" />
		<skill name="Deadly Strike" id="1632" level="2" required-level="77" sp="10200000" />
		<skill name="Song of Renewal" id="349" level="1" required-level="77" sp="10200000">
			<item id="90090"/> <!-- Scroll: Song of Renewal -->
		</skill>
		
		<skill name="Arrest" id="402" level="12" required-level="78" sp="23800000" />
		<skill name="Sword/Blunt Weapon Mastery" id="217" level="48" required-level="78" sp="23800000" />
		<skill name="Heavy Armor Mastery" id="232" level="55" required-level="78" sp="23800000" />
		<skill name="Magic Resistance" id="147" level="54" required-level="78" sp="23800000" />
		<skill name="Entangle" id="102" level="18" required-level="78" sp="23800000" />
		<skill name="Charm" id="15" level="54" required-level="78" sp="23800000" />
		<skill name="Deadly Strike" id="1632" level="3" required-level="78" sp="23800000" />
		<skill name="Champion Song" id="364" level="1" required-level="78" sp="23800000">
			<item id="90091"/> <!-- Scroll: Champion Song -->
		</skill>
		
		<skill name="Song of Silence" id="437" level="1" required-level="79" sp="23800000">
			<item id="90092"/>  <!-- Scroll: Song of Silence -->
		</skill>
		
		<skill name="Sword/Blunt Weapon Mastery" id="217" level="49" required-level="80" sp="23800000" />
		<skill name="Heavy Armor Mastery" id="232" level="56" required-level="80" sp="23800000" />
		<skill name="Magic Resistance" id="147" level="55" required-level="80" sp="23800000" />
		<skill name="Sword Symphony" id="98" level="7" required-level="80" sp="23800000" />
		<skill name="Deadly Strike" id="1632" level="4" required-level="80" sp="23800000" />
		<skill name="Song of Purification" id="914" level="1" required-level="80" sp="23800000">
			<item id="90093"/> <!-- Scroll: Song of Purification -->
		</skill>

		<skill name="Sword/Blunt Weapon Mastery" id="217" level="50" required-level="81" sp="160000000" />
		<skill name="Heavy Armor Mastery" id="232" level="57" required-level="81" sp="160000000" />
		<skill name="Magic Resistance" id="147" level="56" required-level="81" sp="160000000" />
		<skill name="Song of Wind" id="268" level="2" required-level="81" sp="160000000" />
		<skill name="Song of Silence" id="437" level="2" required-level="81" sp="160000000" />
		<skill name="Deadly Strike" id="1632" level="5" required-level="81" sp="160000000" />

		<skill name="Sword/Blunt Weapon Mastery" id="217" level="51" required-level="82" sp="170000000" />
		<skill name="Heavy Armor Mastery" id="232" level="58" required-level="82" sp="170000000" />
		<skill name="Magic Resistance" id="147" level="57" required-level="82" sp="170000000" />
		<skill name="Song of Vitality" id="304" level="2" required-level="82" sp="170000000" />
		<skill name="Deadly Strike" id="1632" level="6" required-level="82" sp="170000000" />

		<skill name="Sword/Blunt Weapon Mastery" id="217" level="52" required-level="83" sp="240000000" />
		<skill name="Heavy Armor Mastery" id="232" level="59" required-level="83" sp="240000000" />
		<skill name="Magic Resistance" id="147" level="58" required-level="83" sp="240000000" />
		<skill name="Hunter's Song" id="269" level="2" required-level="83" sp="240000000" />
		<skill name="Song of Silence" id="437" level="3" required-level="83" sp="240000000" />
		<skill name="Deadly Strike" id="1632" level="7" required-level="83" sp="240000000" />

		<skill name="Sword/Blunt Weapon Mastery" id="217" level="53" required-level="84" sp="240000000" />
		<skill name="Heavy Armor Mastery" id="232" level="60" required-level="84" sp="240000000" />
		<skill name="Magic Resistance" id="147" level="59" required-level="84" sp="240000000" />
		<skill name="Song of Renewal" id="349" level="2" required-level="84" sp="240000000" />
		<skill name="Sword Symphony" id="98" level="8" required-level="84" sp="240000000" />
		<skill name="Deadly Strike" id="1632" level="8" required-level="84" sp="240000000" />
		
		<skill name="Sword/Blunt Weapon Mastery" id="217" level="54" required-level="85" sp="840000000" />
		<skill name="Sword/Blunt Weapon Mastery" id="217" level="55" required-level="86" sp="924000000" />
		<skill name="Sword/Blunt Weapon Mastery" id="217" level="56" required-level="87" sp="1016400000" />
		<skill name="Sword/Blunt Weapon Mastery" id="217" level="57" required-level="88" sp="1118040000" />
		<skill name="Sword/Blunt Weapon Mastery" id="217" level="58" required-level="89" sp="1229844000" />
		<skill name="Sword/Blunt Weapon Mastery" id="217" level="59" required-level="90" sp="1352828400" />
		<skill name="Heavy Armor Mastery" id="232" level="61" required-level="85" sp="840000000" />
		<skill name="Heavy Armor Mastery" id="232" level="62" required-level="86" sp="924000000" />
		<skill name="Heavy Armor Mastery" id="232" level="63" required-level="87" sp="1016400000" />
		<skill name="Heavy Armor Mastery" id="232" level="64" required-level="88" sp="1118040000" />
		<skill name="Heavy Armor Mastery" id="232" level="65" required-level="89" sp="1229844000" />
		<skill name="Heavy Armor Mastery" id="232" level="66" required-level="90" sp="1352828400" />
		<skill name="Magic Resistance" id="147" level="60" required-level="85" sp="840000000" />
		<skill name="Magic Resistance" id="147" level="61" required-level="86" sp="924000000" />
		<skill name="Magic Resistance" id="147" level="62" required-level="87" sp="1016400000" />
		<skill name="Magic Resistance" id="147" level="63" required-level="88" sp="1118040000" />
		<skill name="Magic Resistance" id="147" level="64" required-level="89" sp="1229844000" />
		<skill name="Magic Resistance" id="147" level="65" required-level="90" sp="1352828400" />
	</skillTree>
</list>