<?xml version="1.0" encoding="UTF-8"?>
<list xmlns:xsi="http://www.w3.org/2001/XMLSchema-instance"  xmlns="http://l2j.org" xsi:schemaLocation="http://l2j.org ../../xsd/skillTrees.xsd">
	<skillTree type="classSkillTree" classId="26" parentClassId="25">
		<skill name="Anti Magic" id="146" level="5" required-level="20" sp="600" />
		<skill name="Anti Magic" id="146" level="6" required-level="20" sp="600" />
		<skill name="Quick Recovery" id="164" level="1" required-level="20" sp="600" />
		<skill name="Robe Mastery" id="234" level="1" required-level="20" sp="600" />
		<skill name="Robe Mastery" id="234" level="2" required-level="20" sp="600" />
		<skill name="Weapon Mastery" id="249" level="3" required-level="20" sp="600" />
		<skill name="Aqua Swirl" id="1175" level="1" required-level="20" sp="600" />
		<skill name="Aqua Swirl" id="1175" level="2" required-level="20" sp="600" />
		<skill name="Ice Bolt" id="1184" level="5" required-level="20" sp="600" />
		<skill name="Ice Bolt" id="1184" level="6" required-level="20" sp="600" />
		<skill name="Servitor Heal" id="1127" level="1" required-level="20" sp="600" />
		<skill name="Servitor Heal" id="1127" level="2" required-level="20" sp="600" />
		<skill name="Servitor Heal" id="1127" level="3" required-level="20" sp="600" />
		<skill name="Summon Boxer the Unicorn" id="1226" level="1" required-level="20" sp="600" />
		<skill name="Summon Mirage the Unicorn" id="1227" level="1" required-level="20" sp="600" />
		<skill name="Curse Weakness" id="1164" level="2" required-level="20" sp="600" />
		<skill name="Aura Burn" id="1172" level="1" required-level="20" sp="600" />
		<skill name="Aura Burn" id="1172" level="2" required-level="20" sp="600" />
		<skill name="Boost Mana" id="213" level="1" required-level="20" sp="600" />
		<skill name="Flame Strike" id="1181" level="1" required-level="20" sp="600" />
		<skill name="Higher Mana Gain" id="285" level="1" required-level="20" sp="600" />
		<skill name="Higher Mana Gain" id="285" level="2" required-level="20" sp="600" />
		<skill name="Energy Bolt" id="1274" level="1" required-level="20" sp="600" />
		<skill name="Concentration" id="1078" level="1" required-level="20" sp="600">
			<item id="1399"/>
		</skill>

		<skill name="Anti Magic" id="146" level="7" required-level="23" sp="2300" />
		<skill name="Robe Mastery" id="234" level="3" required-level="23" sp="2300" />
		<skill name="Weapon Mastery" id="249" level="4" required-level="23" sp="2300" />
		<skill name="Aqua Swirl" id="1175" level="3" required-level="23" sp="2300" />
		<skill name="Servitor Heal" id="1127" level="4" required-level="23" sp="2300" />
		<skill name="Aura Burn" id="1172" level="3" required-level="23" sp="2300" />
		<skill name="Higher Mana Gain" id="285" level="3" required-level="23" sp="2300" />
		<skill name="Sleep" id="1069" level="1" required-level="23" sp="2300">
			<item id="1394"/>
		</skill>
		
		<skill name="Servitor Heal" id="1127" level="5" required-level="24" sp="2300" />
		<skill name="Sleep" id="1069" level="2" required-level="24" sp="2300" />

		<skill name="Anti Magic" id="146" level="8" required-level="25" sp="2300" />
		<skill name="Fast Mana Recovery" id="229" level="1" required-level="25" sp="2300" />
		<skill name="Fast Spell Casting" id="228" level="1" required-level="25" sp="2300" />
		<skill name="Robe Mastery" id="234" level="4" required-level="25" sp="2300" />
		<skill name="Weapon Mastery" id="249" level="5" required-level="25" sp="2300" />
		<skill name="Aqua Swirl" id="1175" level="4" required-level="25" sp="2300" />
		<skill name="Servitor Heal" id="1127" level="6" required-level="25" sp="2300" />
		<skill name="Servitor Recharge" id="1126" level="1" required-level="25" sp="2300" />
		<skill name="Servitor Recharge" id="1126" level="2" required-level="25" sp="2300" />
		<skill name="Summon Boxer the Unicorn" id="1226" level="2" required-level="25" sp="2300" />
		<skill name="Summon Mirage the Unicorn" id="1227" level="2" required-level="25" sp="2300" />
		<skill name="Curse Weakness" id="1164" level="3" required-level="25" sp="2300" />
		<skill name="Body To Mind" id="1157" level="1" required-level="25" sp="2300" />
		<skill name="Aura Burn" id="1172" level="4" required-level="25" sp="2300" />
		<skill name="Solar Spark" id="1264" level="1" required-level="25" sp="2300" />
		<skill name="Flame Strike" id="1181" level="2" required-level="25" sp="2300" />
		<skill name="Higher Mana Gain" id="285" level="4" required-level="25" sp="2300" />
		<skill name="Sleep" id="1069" level="3" required-level="25" sp="2300" />
		<skill name="Energy Bolt" id="1274" level="2" required-level="25" sp="2300" />
		
		<skill name="Anti Magic" id="146" level="9" required-level="28" sp="5700" />
		<skill name="Robe Mastery" id="234" level="5" required-level="28" sp="5700" />
		<skill name="Weapon Mastery" id="249" level="6" required-level="28" sp="5700" />
		<skill name="Aqua Swirl" id="1175" level="5" required-level="28" sp="5700" />
		<skill name="Servitor Heal" id="1127" level="7" required-level="28" sp="5700" />
		<skill name="Aura Burn" id="1172" level="5" required-level="28" sp="5700" />
		<skill name="Higher Mana Gain" id="285" level="5" required-level="28" sp="5700" />
		<skill name="Sleep" id="1069" level="4" required-level="28" sp="5700" />
		
		<skill name="Servitor Heal" id="1127" level="8" required-level="29" sp="5700" />
		<skill name="Sleep" id="1069" level="5" required-level="29" sp="5700" />

		<skill name="Anti Magic" id="146" level="10" required-level="30" sp="5700" />
		<skill name="Quick Recovery" id="164" level="2" required-level="30" sp="5700" />
		<skill name="Robe Mastery" id="234" level="6" required-level="30" sp="5700" />
		<skill name="Weapon Mastery" id="249" level="7" required-level="30" sp="5700" />
		<skill name="Aqua Swirl" id="1175" level="6" required-level="30" sp="5700" />
		<skill name="Concentration" id="1078" level="2" required-level="30" sp="5700" />
		<skill name="Servitor Heal" id="1127" level="9" required-level="30" sp="5700" />
		<skill name="Servitor Recharge" id="1126" level="3" required-level="30" sp="5700" />
		<skill name="Servitor Recharge" id="1126" level="4" required-level="30" sp="5700" />
		<skill name="Summon Boxer the Unicorn" id="1226" level="3" required-level="30" sp="5700" />
		<skill name="Summon Mirage the Unicorn" id="1227" level="3" required-level="30" sp="5700" />
		<skill name="Curse Weakness" id="1164" level="4" required-level="30" sp="5700" />
		<skill name="Aura Burn" id="1172" level="6" required-level="30" sp="5700" />
		<skill name="Solar Spark" id="1264" level="2" required-level="30" sp="5700" />
		<skill name="Boost Mana" id="213" level="2" required-level="30" sp="5700" />
		<skill name="Flame Strike" id="1181" level="3" required-level="30" sp="5700" />
		<skill name="Higher Mana Gain" id="285" level="6" required-level="30" sp="5700" />
		<skill name="Sleep" id="1069" level="6" required-level="30" sp="5700" />
		<skill name="Energy Bolt" id="1274" level="3" required-level="30" sp="5700" />
		
		<skill name="Anti Magic" id="146" level="11" required-level="33" sp="13000" />
		<skill name="Robe Mastery" id="234" level="7" required-level="33" sp="13000" />
		<skill name="Weapon Mastery" id="249" level="8" required-level="33" sp="13000" />
		<skill name="Aqua Swirl" id="1175" level="7" required-level="33" sp="13000" />
		<skill name="Servitor Heal" id="1127" level="10" required-level="33" sp="13000" />
		<skill name="Aura Burn" id="1172" level="7" required-level="33" sp="13000" />
		<skill name="Higher Mana Gain" id="285" level="7" required-level="33" sp="13000" />
		<skill name="Sleep" id="1069" level="7" required-level="33" sp="13000" />
		
		<skill name="Servitor Heal" id="1127" level="11" required-level="34" sp="13000" />
		<skill name="Sleep" id="1069" level="8" required-level="34" sp="13000" />

		<skill name="Anti Magic" id="146" level="12" required-level="35" sp="13000" />
		<skill name="Fast HP Recovery" id="212" level="1" required-level="35" sp="13000" />
		<skill name="Fast Mana Recovery" id="229" level="2" required-level="35" sp="13000" />
		<skill name="Robe Mastery" id="234" level="8" required-level="35" sp="13000" />
		<skill name="Weapon Mastery" id="249" level="9" required-level="35" sp="13000" />
		<skill name="Aqua Swirl" id="1175" level="8" required-level="35" sp="13000" />
		<skill name="Servitor Heal" id="1127" level="12" required-level="35" sp="13000" />
		<skill name="Servitor Recharge" id="1126" level="5" required-level="35" sp="13000" />
		<skill name="Servitor Recharge" id="1126" level="6" required-level="35" sp="13000" />
		<skill name="Summon Boxer the Unicorn" id="1226" level="4" required-level="35" sp="13000" />
		<skill name="Summon Mirage the Unicorn" id="1227" level="4" required-level="35" sp="13000" />
		<skill name="Curse Weakness" id="1164" level="5" required-level="35" sp="13000" />
		<skill name="Aura Burn" id="1172" level="8" required-level="35" sp="13000" />
		<skill name="Solar Spark" id="1264" level="3" required-level="35" sp="13000" />
		<skill name="Servitor Magic Boost" id="1145" level="1" required-level="35" sp="13000" />
		<skill name="Higher Mana Gain" id="285" level="8" required-level="35" sp="13000" />
		<skill name="Sleep" id="1069" level="9" required-level="35" sp="13000" />
		<skill name="Energy Bolt" id="1274" level="4" required-level="35" sp="13000" />
	</skillTree>
</list>