<?xml version="1.0" encoding="UTF-8"?>
<list xmlns:xsi="http://www.w3.org/2001/XMLSchema-instance"  xmlns="http://l2j.org" xsi:schemaLocation="http://l2j.org ../../xsd/skillTrees.xsd">
	<skillTree type="classSkillTree" classId="205" parentClassId="204">

		<!-- Skills Lv20 -->
		<skill skillName="Death Armor Mastery" skillId="45354" skillLvl="4" getLevel="20" levelUpSp="1000" />
		<skill skillName="Death Sword Mastery" skillId="45353" skillLvl="4" getLevel="20" levelUpSp="1000" />
		<skill skillName="Empower" skillId="45105" skillLvl="1" getLevel="20" levelUpSp="1000" />
		<skill skillName="Recover HP" skillId="45176" skillLvl="1" getLevel="20" levelUpSp="1000" />
		<skill skillName="Recover MP" skillId="45177" skillLvl="1" getLevel="20" levelUpSp="1000" />
		<skill skillName="Punishment" skillId="45301" skillLvl="1" getLevel="20" autoGet="true" />
		<skill skillName="Wind Walk" skillId="45107" skillLvl="1" getLevel="20" levelUpSp="1000" />
		<skill skillName="Enhanced Weapon" skillId="255" skillLvl="1" getLevel="20" levelUpSp="1000" />
		<skill skillName="Enhanced Weapon" skillId="255" skillLvl="2" getLevel="20" levelUpSp="1000" />
		<skill skillName="Enhanced Weapon" skillId="255" skillLvl="3" getLevel="20" levelUpSp="1000" />
		<skill skillName="Enhanced Weapon" skillId="255" skillLvl="4" getLevel="20" levelUpSp="1000" />
		<skill skillName="Enhanced Weapon" skillId="255" skillLvl="5" getLevel="20" levelUpSp="1000" />
		<skill skillName="Might" skillId="1068" skillLvl="2" getLevel="20" levelUpSp="1000" />
		<skill skillName="Acumen" skillId="45104" skillLvl="1" getLevel="20" levelUpSp="1000" />
		<skill skillName="Ability to Protect" skillId="91" skillLvl="2" getLevel="20" levelUpSp="1000" />
		<skill skillName="Haste" skillId="45111" skillLvl="1" getLevel="20" levelUpSp="1000" />
		<skill skillName="Focus" skillId="45109" skillLvl="1" getLevel="20" levelUpSp="1000" />
		<skill skillName="Clarity" skillId="45113" skillLvl="1" getLevel="20" levelUpSp="1000" />
		<skill skillName="Death Whisper" skillId="45110" skillLvl="1" getLevel="20" levelUpSp="1000" />
		<skill skillName="Shield" skillId="1040" skillLvl="2" getLevel="20" levelUpSp="1000" />
		<skill skillName="Emergency Rescue" skillId="70" skillLvl="3" getLevel="20" levelUpSp="1000" />
		<skill skillName="Dark Elven Spirit" skillId="129" skillLvl="1" getLevel="20" levelUpSp="1000" />

		<!-- Skills Lv21 -->
		<skill skillName="Enhanced Weapon" skillId="255" skillLvl="6" getLevel="21" levelUpSp="2500" />

		<!-- Skills Lv22 -->
		<skill skillName="Enhanced Weapon" skillId="255" skillLvl="7" getLevel="22" levelUpSp="2500" />

		<!-- Skills Lv23 -->
		<skill skillName="Enhanced Weapon" skillId="255" skillLvl="8" getLevel="23" levelUpSp="2500" />

		<!-- Skills Lv24 -->
		<skill skillName="Confusion" skillId="2" skillLvl="1" getLevel="24" levelUpSp="2500" />
		<skill skillName="Confusion" skillId="2" skillLvl="2" getLevel="24" levelUpSp="2500" />
		<skill skillName="Enhanced Weapon" skillId="255" skillLvl="9" getLevel="24" levelUpSp="2500" />

		<!-- Skills Lv25 -->
		<skill skillName="Confusion" skillId="2" skillLvl="3" getLevel="25" levelUpSp="5500" />
		<skill skillName="Death Armor Mastery" skillId="45354" skillLvl="5" getLevel="25" levelUpSp="5500" />
		<skill skillName="Death Sword Mastery" skillId="45353" skillLvl="5" getLevel="25" levelUpSp="5500" />
		<skill skillName="Enhanced Weapon" skillId="255" skillLvl="10" getLevel="25" levelUpSp="5500" />
		<skill skillName="Ability to Attack" skillId="77" skillLvl="2" getLevel="25" levelUpSp="5500" />
		<skill skillName="Emergency Rescue" skillId="70" skillLvl="4" getLevel="25" levelUpSp="5500" />

		<!-- Skills Lv26 -->
		<skill skillName="Confusion" skillId="2" skillLvl="4" getLevel="26" levelUpSp="5500" />
		<skill skillName="Punishment" skillId="45301" skillLvl="2" getLevel="26" levelUpSp="5500" />
		<skill skillName="Enhanced Weapon" skillId="255" skillLvl="11" getLevel="26" levelUpSp="5500" />

		<!-- Skills Lv27 -->
		<skill skillName="Confusion" skillId="2" skillLvl="5" getLevel="27" levelUpSp="5500" />
		<skill skillName="Enhanced Weapon" skillId="255" skillLvl="12" getLevel="27" levelUpSp="5500" />

		<!-- Skills Lv28 -->
		<skill skillName="Confusion" skillId="2" skillLvl="6" getLevel="28" levelUpSp="5500" />
		<skill skillName="Confusion" skillId="2" skillLvl="7" getLevel="28" levelUpSp="5500" />
		<skill skillName="Enhanced Weapon" skillId="255" skillLvl="13" getLevel="28" levelUpSp="5500" />

		<!-- Skills Lv29 -->
		<skill skillName="Confusion" skillId="2" skillLvl="8" getLevel="29" levelUpSp="10000" />
		<skill skillName="Enhanced Weapon" skillId="255" skillLvl="14" getLevel="29" levelUpSp="10000" />

		<!-- Skills Lv30 -->
		<skill skillName="Confusion" skillId="2" skillLvl="9" getLevel="30" levelUpSp="10000" />
		<skill skillName="Death Armor Mastery" skillId="45354" skillLvl="6" getLevel="30" levelUpSp="10000" />
		<skill skillName="Death Sword Mastery" skillId="45353" skillLvl="6" getLevel="30" levelUpSp="10000" />
		<skill skillName="Empower" skillId="45105" skillLvl="2" getLevel="30" levelUpSp="11000" />
		<skill skillName="Wild Magic" skillId="45106" skillLvl="1" getLevel="30" levelUpSp="11000" />
		<skill skillName="Berserker Spirit" skillId="45112" skillLvl="1" getLevel="30" levelUpSp="11000" />
		<skill skillName="Wind Walk" skillId="45107" skillLvl="2" getLevel="30" levelUpSp="11000" />
		<skill skillName="Magic Barrier" skillId="45108" skillLvl="1" getLevel="30" levelUpSp="11000" />
		<skill skillName="Enhanced Weapon" skillId="255" skillLvl="15" getLevel="30" levelUpSp="10000" />
		<skill skillName="Acumen" skillId="45104" skillLvl="2" getLevel="30" levelUpSp="11000" />
		<skill skillName="Roar of Death" skillId="45328" skillLvl="1" getLevel="30" levelUpSp="10000" />
		<skill skillName="Focus" skillId="45109" skillLvl="2" getLevel="30" levelUpSp="11000" />
		<skill skillName="Clarity" skillId="45113" skillLvl="2" getLevel="30" levelUpSp="11000" />
		<skill skillName="Death Whisper" skillId="45110" skillLvl="2" getLevel="30" levelUpSp="11000" />
		<skill skillName="Emergency Rescue" skillId="70" skillLvl="5" getLevel="30" levelUpSp="10000" />

		<!-- Skills Lv31 -->
		<skill skillName="Confusion" skillId="2" skillLvl="10" getLevel="31" levelUpSp="10000" />

		<!-- Skills Lv32 -->
		<skill skillName="Confusion" skillId="2" skillLvl="11" getLevel="32" levelUpSp="10000" />
		<skill skillName="Confusion" skillId="2" skillLvl="12" getLevel="32" levelUpSp="10000" />
		<skill skillName="Punishment" skillId="45301" skillLvl="3" getLevel="32" levelUpSp="10000" />
		<skill skillName="Emergency Rescue" skillId="70" skillLvl="6" getLevel="32" levelUpSp="10000" />
		<skill skillName="Power Break" skillId="115" skillLvl="1" getLevel="32" levelUpSp="10000"/>

		<!-- Skills Lv33 -->
		<skill skillName="Confusion" skillId="2" skillLvl="13" getLevel="33" levelUpSp="20000" />

		<!-- Skills Lv34 -->
		<skill skillName="Confusion" skillId="2" skillLvl="14" getLevel="34" levelUpSp="20000" />
		<skill skillName="Emergency Rescue" skillId="70" skillLvl="7" getLevel="34" levelUpSp="20000" />

		<!-- Skills Lv35 -->
		<skill skillName="Confusion" skillId="2" skillLvl="15" getLevel="35" levelUpSp="20000" />
		<skill skillName="Dark Elven Spirit" skillId="129" skillLvl="2" getLevel="35" levelUpSp="20000" />
		<skill skillName="Death Armor Mastery" skillId="45354" skillLvl="7" getLevel="35" levelUpSp="20000" />
		<skill skillName="Death Sword Mastery" skillId="45353" skillLvl="7" getLevel="35" levelUpSp="20000" />

		<!-- Skills Lv36 -->
		<skill skillName="Confusion" skillId="2" skillLvl="16" getLevel="36" levelUpSp="20000" />
		<skill skillName="Confusion" skillId="2" skillLvl="17" getLevel="36" levelUpSp="20000" />
		<skill skillName="Emergency Rescue" skillId="70" skillLvl="8" getLevel="36" levelUpSp="20000" />
		<skill skillName="Power Break" skillId="115" skillLvl="2" getLevel="36" levelUpSp="20000" />

		<!-- Skills Lv37 -->
		<skill skillName="Confusion" skillId="2" skillLvl="18" getLevel="37" levelUpSp="20000" />

		<!-- Skills Lv38 -->
		<skill skillName="Confusion" skillId="2" skillLvl="19" getLevel="38" levelUpSp="20000" />
		<skill skillName="Punishment" skillId="45301" skillLvl="4" getLevel="38" levelUpSp="20000" />
		<skill skillName="Emergency Rescue" skillId="70" skillLvl="9" getLevel="38" levelUpSp="20000" />

		<!-- Skills Lv39 -->
		<skill skillName="Confusion" skillId="2" skillLvl="20" getLevel="39" levelUpSp="20000" />
		
	</skillTree>
</list>