<?xml version="1.0" encoding="UTF-8"?>
<list xmlns:xsi="http://www.w3.org/2001/XMLSchema-instance"  xmlns="http://l2j.org" xsi:schemaLocation="http://l2j.org ../../xsd/skillTrees.xsd">
	<skillTree type="classSkillTree" classId="25">
	
		<!-- Starting Skills Lv1 -->
		<skill name="Magician's Attitude" id="118" level="1" required-level="1" auto-learn="true" />
		<skill name="Armor Mastery" id="244" level="1" required-level="1" auto-learn="true" />
		<skill name="Weapon Mastery" id="249" level="1" required-level="1" auto-learn="true" />
		<skill name="Fireball" id="1147" level="1" required-level="1" auto-learn="true" />
		<skill name="Wind Strike" id="1177" level="1" required-level="1" auto-learn="true" />
		<skill name="Ice Bolt" id="1184" level="1" required-level="1" auto-learn="true" />
		<skill name="Self Heal" id="1216" level="1" required-level="1" auto-learn="true" />
		<skill name="Children of Eva" id="53008" level="1" required-level="1" auto-learn="true" />
		<skill name="Mana Recovery" id="214" level="1" required-level="1" auto-learn="true" />
		<skill name="Spellcraft" id="163" level="1" required-level="1" auto-learn="true" />

		<!-- Inventory Expansion -->		
		<skill name="Extra Inventory" id="1372" level="1" required-level="1" >
			<item id="92004" count="1"/> <!-- Inventory Expansion Ticket Lv. 1 -->
		</skill>
		<skill name="Extra Inventory" id="1372" level="2" required-level="1" >
			<item id="92005" count="1"/>   <!-- Inventory Expansion Ticket Lv. 2 -->
		</skill>
		<skill name="Extra Inventory" id="1372" level="3" required-level="1" >
			<item id="92006" count="1"/>  <!-- Inventory Expansion Ticket Lv. 3  -->
		</skill>
		<skill name="Extra Inventory" id="1372" level="4" required-level="1" >
			<item id="92007" count="1"/>  <!-- Inventory Expansion Ticket Lv. 4 -->
		</skill>
		<skill name="Extra Inventory" id="1372" level="5" required-level="1" >
			<item id="92008" count="1"/>  <!-- Inventory Expansion Ticket Lv. 5 -->
		</skill>
		
		<!-- Skills Lv2 -->		
		<skill name="Shield" id="1040" level="1" required-level="2" sp="5" />

		<!-- Skills Lv3 -->
		<skill name="Heal" id="1011" level="1" required-level="3" sp="10" />
		<skill name="Might" id="1068" level="1" required-level="3" sp="5" />

		<!-- Skills Lv4 -->
		<skill name="Anti Magic" id="146" level="1" required-level="4" sp="15" />
		<skill name="Ice Bolt" id="1184" level="2" required-level="4" sp="15" />
		<skill name="Wind Strike" id="1177" level="2" required-level="4" sp="15" />

		<!-- Skills Lv5 -->
		<skill name="Heal" id="1011" level="2" required-level="5" sp="20" />
		<skill name="Self Heal" id="1216" level="2" required-level="5" sp="20" />

		<!-- Skills Lv7 -->
		<skill name="Anti Magic" id="146" level="2" required-level="7" sp="25" />
		<skill name="Cure" id="1012" level="1" required-level="7" sp="25" />
		<skill name="Ice Bolt" id="1184" level="3" required-level="7" sp="25" />
		<skill name="Heal" id="1011" level="3" required-level="7" sp="25" />
		<skill name="Wind Strike" id="1177" level="3" required-level="7" sp="25" />

		<!-- Skills Lv10 -->
		<skill name="Battle Heal" id="1015" level="1" required-level="10" sp="160" />
		<skill name="Group Heal" id="1027" level="1" required-level="10" sp="160" />
		<skill name="Heal" id="1011" level="4" required-level="10" sp="160" />
		<skill name="Fireball" id="1147" level="2" required-level="10" sp="160" />
		<skill name="Wind Shackle" id="1206" level="1" required-level="10" sp="200" />
		<skill name="Weakness" id="1164" level="1" required-level="10" sp="200" />

		<!-- Skills Lv11 -->
		<skill name="Anti Magic" id="146" level="3" required-level="11" sp="160" />
		<skill name="Armor Mastery" id="244" level="2" required-level="11" sp="160" />
		<skill name="Ice Bolt" id="1184" level="4" required-level="11" sp="160" />
		<skill name="Wind Strike" id="1177" level="4" required-level="11" sp="160" />

		<!-- Skills Lv12 -->
		<skill name="Battle Heal" id="1015" level="2" required-level="12" sp="190" />
		<skill name="Group Heal" id="1027" level="2" required-level="12" sp="190" />
		<skill name="Heal" id="1011" level="5" required-level="12" sp="190" />

		<!-- Skills Lv14 -->
		<skill name="Anti Magic" id="146" level="4" required-level="14" sp="190" />
		<skill name="Battle Heal" id="1015" level="3" required-level="14" sp="190" />
		<skill name="Armor Mastery" id="244" level="3" required-level="14" sp="190" />
		<skill name="Weapon Mastery" id="249" level="2" required-level="14" sp="190" />
		<skill name="Group Heal" id="1027" level="3" required-level="14" sp="190" />
		<skill name="Ice Bolt" id="1184" level="5" required-level="14" sp="190" />
		<skill name="Heal" id="1011" level="6" required-level="14" sp="190" />
		<skill name="Wind Strike" id="1177" level="5" required-level="14" sp="190" />

		<!-- Skills Lv15 -->
		<skill name="Fireball" id="1147" level="3" required-level="15" sp="200" />
		<skill name="Self Heal" id="1216" level="3" required-level="15" sp="250" />

	</skillTree>
</list>